,0,1
0,CHRIS WALLACE:,"Good evening, from the Health Education Campus of Case Western Reserve University and the Cleveland Clinic.  I'm Chris Wallace of Fox News, and I welcome you to the first of the 2020 Presidential Debates between President Donald J. Trump and former Vice President Joe Biden.  This debate is sponsored by the Commission on Presidential Debates.  The Commission has designed the format, six roughly 15-minute segments, with 2-minute answers from each candidate to the first question, then open discussion for the rest of each segment.  Both campaigns have agreed to these rules.  For the record, I decided the topics and the questions in each topic.  I can assure you, none of the questions has been shared with the Commission or the two candidates.  This debate is being conducted under health and safety protocols designed by the Cleveland Clinic, which is serving as the health security advisor to the Commission for all four debates.  As a precaution, both campaigns have agreed the candidates will not shake hands at the beginning of tonight's debate.  The audience here in the hall has promised to remain silent; no cheers, no boos, or other interruptions so we, and more importantly you, can focus on what the candidates have to say.  No noise except right now, as we welcome the Republican nominee, President Trump and the Democratic nominee, Vice President Biden."
1,JOE BIDEN:,"How you doing, man?"
2,DONALD TRUMP:,How are you?
3,JOE BIDEN:,Doing well.
4,CHRIS WALLACE:,"Gentlemen, a lot of people have been waiting for this night.  So, let's get going.  Our first subject is the Supreme Court.  President Trump, you nominated Amy Coney Barrett over the weekend to succeed the late Ruth Bader Ginsburg on the Court.  You say the Constitution is clear about your obligation and the Senate's to consider a nominee to the Court.  Vice President Biden, you say that this is an effort by the President and Republicans to jam through in an appointment in what you call an abuse of power.  My first question to both of you tonight, why are you right in the argument you make, and your opponent wrong, and where do you think a Justice Barrett would take the Court?  President Trump, in this first segment, you go first.  Two minutes."
5,DONALD TRUMP:,"Thank you very much, Chris.  I will tell you very simply, we won the election.  Elections have consequences.  We have the Senate.  We have the White House, and we have a phenomenal nominee, respected by all.  Top, top academic, uh, good in every way.  Good in every way.  In fact, uh, some of her biggest endorsers are very liberal people from Notre Dame and other places.  So I think she's going to be fantastic.  We have plenty of time, uh, even if we did it after the election itself.  I have a lot of time after the election, as you know.  So I think that, uh, she will be outstanding.  She's going to be a, as good as anybody that has served on that Court.  We really feel that.  Uh, we have a professor at Notre Dame, highly respected by all, says she's the single greatest student he's ever had.  He's been a professor for a long time at a great school, and, uh, we just, uh, we won the election, and therefore we have the right to choose her, and very few people knowingly would say otherwise.  And, by the way, the Democrats, they wouldn't even think about not doing it.  If they had, the only difference is they'd try and do it faster.  There's no way they would give it up.  They had Merrick Garland, but the problem is, they didn't have the election, so they were stopped, and probably that would happen in reverse also.  Definitely would happen in reverse.  So we won the election, and we have the right to do it, Chris."
6,CHRIS WALLACE:,"President Trump, thank you.  Um, same question to you, Vice President Biden.  You have 2 minutes."
7,JOE BIDEN:,"Well, first of all, um, thank you for doing this, and –"
8,DONALD TRUMP:,Thank you.
9,JOE BIDEN:,"Looking forward to this, Mr. President."
10,DONALD TRUMP:,"Thank you, Joe."
11,JOE BIDEN:,"I, uh – the American people have a right to have a say in who the Supreme Court nominee is, and that say occurs when they vote for, A) United States Senators, and when they vote for the President of the United States.  They're not going to get that chance now, because we're in the middle of an election already.  The election has already started.  Tens of thousands of people have already voted, and, so the thing that should happen is we should wait.  We should wait and see what the outcome of this election is, because that's the only way the American people get to express their view is by who they elect as President and who they elect as Vice President.  Now, what's at stake here is the President has made it clear he wants to get rid of the Affordable Care Act.  He's been running on that.  He ran on that, and he's been governing on that.  He's in the Supreme Court right now trying to get rid of, uh, the, the Affordable Care Act, which, uh, will strip 20 million people from having insurance, health insurance now, if it, if they, if it goes into Court.  And, and, uh, the Justice – and I have nothing, I'm not opposed to the Justice, because she seems like a very fine person.  What she's written before she went on the bench, which is her right, is she thinks that the Affordable Care Act is not constitutional.  The other thing that's on the Court – and if, if, and if it's struck down, what happens?  Women's rights are fundamentally changed.  Once again, a woman could be held, pay more money because she has a preexisting condition of pregnancy.  We're able to, uh, they're able to charge a woman more for the same exact procedure a man did – gets.  And that ended when we, in fact, passed the Affordable Care Act.  And there's a hundred million people that have preexisting conditions, and they'll be taken away as well.  Those preexisting conditions, the insurance companies are going to love this.  And, so, it's just not appropriate to do this before this election.  If he wins the election and the Senate is Democrat or Republican, then it – he goes forward.  If not, we should wait until February."
12,CHRIS WALLACE:,All right.
13,DONALD TRUMP:,"There aren't a hundred million people with preexisting conditions.  As far as a say is concerned, the people already had their say.  They – okay, Justice Ginsburg said very powerfully, very strongly, at some point, 10 years ago or so, she said a President and the Senate is elected for a period of time.  But a President is elected for 4 years.  We're not elected for 3 years.  I'm not elected for 3 years.  So, we have the Senate.  We have a President."
14,JOE BIDEN:,He's elected until the next election.
15,DONALD TRUMP:,"During that period of time, during that period of time, we have an opening.  I'm not elected for 3 years.  I'm elected for 4 years.  And the hundred million people –"
16,JOE BIDEN:,The election has already started.
17,DONALD TRUMP:,"Joe, the hundred million people is totally wrong.  I don't know where you got that number.  The bigger problem that you have is that you're going to extinguish 180 million people with their private healthcare that they're very happy with."
18,JOE BIDEN:,That's simply not true.
19,DONALD TRUMP:,"Well, you're certainly going to socialist, you're going to socialist medicine."
20,CHRIS WALLACE:,"So, this is, we're now into – gentlemen, we're now into open discussion."
21,JOE BIDEN:,Open discussions.
22,CHRIS WALLACE:,"Open discussion.  Yes, I agree.  Go ahead, Vice President."
23,JOE BIDEN:,"Number one, uh, he, he knows that, uh, what I proposed.  What I proposed is that, uh, we expand Obamacare, and we increase it.  We do not wipe any – and one of the big debates we had with 23 of my colleagues trying to win the nomination that I won were saying that Biden wanted to allow people to have private insurance still.  They can.  They do.  They will, under my proposal."
24,DONALD TRUMP:,That's not what you've said – 
25,JOE BIDEN:,But that is –
26,DONALD TRUMP:,– and it's not what your party has said.
27,JOE BIDEN:,That is simply a lie.
28,DONALD TRUMP:,Your party doesn't say it.
29,JOE BIDEN:,That is – 
30,DONALD TRUMP:,Your party wants to go socialist medicine –
31,JOE BIDEN:,My party is me.
32,DONALD TRUMP:,– and socialist healthcare.
33,JOE BIDEN:,"Right now, I am the Democratic Party."
34,DONALD TRUMP:,"And they're going to dominate you, Joe.  You know that."
35,JOE BIDEN:,"I am the Democratic Party, right now.  The platform of the Democratic Party is –"
36,DONALD TRUMP:,Not according to Harris.
37,JOE BIDEN:,"– what I, in fact, approved of.  What I approved of.  Now, here's the deal.  The deal is that it's going to wipe out preexisting conditions.  And, by the way, the 20, the 200 million, the 200,000 people that have died on his watch, they are – how many of those, uh, have survived?  Well, there's 7,000,000 people that have contracted COVID.  What does it mean for them going forward if you strike down the Affordable Care Act and – "
38,DONALD TRUMP:,"Joe, you've had 308,000 military people dying because you couldn't provide them proper healthcare in the military.  So, don't tell me about this."
39,JOE BIDEN:,I'm happy to talk about this.
40,DONALD TRUMP:,"And if you were here, you –"
41,JOE BIDEN:,"Look, here's the deal."
42,DONALD TRUMP:,"It wouldn't be 200, it would be 2,000,000, people because you were very late on the draw."
43,JOE BIDEN:,Late on the draw.
44,DONALD TRUMP:,"You didn't want me to ban China, which was heavily infected.  You didn't want me to ban –"
45,CHRIS WALLACE:,"All right.  We're, uh, gentlemen –"
46,DONALD TRUMP:,"– Europe, which was heavily – "
47,CHRIS WALLACE:,"We, we – no.  Mr. President?"
48,DONALD TRUMP:,"You would have been much later, Joe."
49,CHRIS WALLACE:,Mr. President?  Mr. President?
50,DONALD TRUMP:,"Much later.  You're talking about 2,000,000 people."
51,CHRIS WALLACE:,Mr. President –
52,JOE BIDEN:,You're not going to be able to shut him up.
53,CHRIS WALLACE:,"Mr. President, as a moderator – we are going to talk about COVID in the next segment.  But go ahead."
54,JOE BIDEN:,"Let me finish.  The point is that the President also is opposed to Roe v. Wade.  That's on the ballot as well in the Court, in the Court.  And so that's also at stake right now.  And so the election is already begun – "
55,DONALD TRUMP:,You don't know what's on the ballot.
56,JOE BIDEN:,I –
57,DONALD TRUMP:,Why is it on the ballot?
58,JOE BIDEN:,"Because, because you said you're –"
59,DONALD TRUMP:,Why is it on the ballot?  It's not on the ballot.
60,JOE BIDEN:,It's on the ballot in the Court.
61,DONALD TRUMP:,I don't think so.
62,JOE BIDEN:,In the Court.  Well –
63,DONALD TRUMP:,There's nothing happening there.
64,JOE BIDEN:,"Donald, would you just be quiet for a minute?"
65,DONALD TRUMP:,And you don't know her view on Roe v. Wade.
66,JOE BIDEN:,I don't know.
67,DONALD TRUMP:,You don't know her view.
68,CHRIS WALLACE:,"Well, all right, let's – all right, let's talk, I – we've got a lot to unpack here, gentlemen.  We got a lot of time.  So, uh, on healthcare, uh, and then we'll come back to Roe v. Wade."
69,JOE BIDEN:,All right.
70,CHRIS WALLACE:,"Mr. President, the Supreme Court will hear a case a week after the election in which the Trump administration, along with 18 state attorneys general, are seeking to overturn –"
71,DONALD TRUMP:,That's right.
72,CHRIS WALLACE:,– Obamacare.  To end Obamacare.  You have spent the last –
73,DONALD TRUMP:,Because we want to give –
74,CHRIS WALLACE:,"Let me, if I, if I may –"
75,DONALD TRUMP:,– good healthcare.
76,CHRIS WALLACE:,If I may ask –
77,DONALD TRUMP:,Go ahead.
78,CHRIS WALLACE:,"– my question, sir."
79,JOE BIDEN:,Good healthcare.
80,CHRIS WALLACE:,"Over, uh, the last 4 years, you have promised to repeal and replace Obamacare, but you have never in these 4 years come up with a plan, a comprehensive plan –"
81,DONALD TRUMP:,Of course I have.
82,CHRIS WALLACE:,– to replace Obamacare.
83,DONALD TRUMP:,Of course I have.
84,CHRIS WALLACE:,"Well, I'll give you an opportunity –"
85,DONALD TRUMP:,We got rid of the individual mandate.
86,CHRIS WALLACE:,"When I finish, I'm going to give you an opportunity, but I –"
87,DONALD TRUMP:,"Excuse me, I got rid of the individual mandate, which was a big chunk of Ob –"
88,CHRIS WALLACE:,That is not a comprehensive plan.
89,DONALD TRUMP:,That is absolutely a big thing.  That was the worst –
90,CHRIS WALLACE:,"Okay, I, I didn't ask –"
91,DONALD TRUMP:,– part of Obamacare.
92,CHRIS WALLACE:,Sir –
93,DONALD TRUMP:,"Chris, that was the worst part of Obamacare."
94,CHRIS WALLACE:,– (inaudible) him and not me.  Let me ask my question.
95,DONALD TRUMP:,"Well, I'll, I'll ask Joe."
96,CHRIS WALLACE:,"I, I, uh, I, no, I –"
97,DONALD TRUMP:,The individual mandate was the most unpopular aspect–
98,CHRIS WALLACE:,"Mr. Vice Pre, Mr. President –"
99,DONALD TRUMP:,– of Obamacare.  I got rid of it.
100,CHRIS WALLACE:,I would like you to –
101,DONALD TRUMP:,And we will protect people –
102,CHRIS WALLACE:,Mr. President –
103,DONALD TRUMP:,– with preexisting conditions.
104,CHRIS WALLACE:,"– I'm the moderator of this debate, and I would like you to let me ask my question, and then you can answer."
105,DONALD TRUMP:,Go ahead.
106,CHRIS WALLACE:,"You, in the course of these 4 years have never come up with a comprehensive plan to replace Obamacare, and just this last Thursday, you signed a largely symbolic executive order –"
107,DONALD TRUMP:,That's – 
108,CHRIS WALLACE:,"– to protect people with preexisting conditions 5 days before this debate.  So, my question, sir, is what is the Trump healthcare plan?"
109,DONALD TRUMP:,"All right.  Well, first of all, I guess I'm debating you, not him.  But that's okay.  I'm not surprised.  Let me just tell you something, that there's nothing symbolic.  I'm cutting drug prices.  I'm going with favored nations, which no president has the courage to do, because you're going against big pharma.  Drug prices will be coming down 80 or 90 percent.  You could have done it during your 47year period in government, but you didn't do it.  Nobody's done it.  So, we're cutting healthcare."
110,CHRIS WALLACE:,What about preexisting conditions?
111,DONALD TRUMP:,All of the things that we've done –
112,JOE BIDEN:,He has not cut healthcare.
113,DONALD TRUMP:,"Insulin.  I'll give you an example.  Insulin.  It's going to, it was destroying families, destroying people, the cost.  I'm getting it for so cheap, it's like water.  You want to know the truth?  So cheap.  Take a look at all of the drugs that, what we're doing, prescription drug prices.  We're going to allow our governors now to go to other countries to buy drugs –"
114,CHRIS WALLACE:,Okay.
115,DONALD TRUMP:,– because they pay just a tiny fraction.
116,CHRIS WALLACE:,"I've got to say, this is open discussion."
117,DONALD TRUMP:,"No, but this is big – "
118,CHRIS WALLACE:,"Let me ask you about, let me ask – you'll be happy."
119,DONALD TRUMP:,This is big stuff.
120,CHRIS WALLACE:,"Sir, you'll be happy.  I'm about to pick up on one of your points to ask the Vice President, which is he points out that you would like to add a public option to Obamacare."
121,JOE BIDEN:,Yes.
122,CHRIS WALLACE:,"And the argument that he makes, and other Republicans make, is that that is going to end private insurance, and will –"
123,JOE BIDEN:,It is not.
124,CHRIS WALLACE:,Uh –
125,JOE BIDEN:,I'm sorry.
126,CHRIS WALLACE:,"Can I ask you the question?  And, it will end –"
127,DONALD TRUMP:,"That's not what your party says, by the way."
128,CHRIS WALLACE:,It will end private insurance and create a government takeover of healthcare.
129,JOE BIDEN:,"It does not.  It's only for those people who are so poor they qualify for Medicaid.  They can get that free in most states, expect governors who want to deny people who are poor Medicaid.  Anyone who qualifies for Medicare would, excuse me, Medicaid, would automatically be enrolled in the public option.  The vast majority of the American people would still not be in that option, number one."
130,DONALD TRUMP:,"Joe, you agreed –"
131,JOE BIDEN:,Number two –
132,DONALD TRUMP:,– with Bernie Sanders –
133,JOE BIDEN:,"Number, I, I didn't –"
134,DONALD TRUMP:,"– who is far left on the manifesto, we call it."
135,JOE BIDEN:,We knew –  manifesto –
136,DONALD TRUMP:,And that gives you socialized medicine.
137,JOE BIDEN:,"Look, hey.  I'm not –"
138,DONALD TRUMP:,Are you saying you didn't agree?
139,JOE BIDEN:,"– going to listen to him.  The fact of the matter is, I beat Bernie Sanders."
140,DONALD TRUMP:,Not by much.
141,JOE BIDEN:,"I, I beat him a whole hell of a lot."
142,DONALD TRUMP:,Not by much.
143,JOE BIDEN:,"I'm here, I'm here standing facing you, old buddy."
144,DONALD TRUMP:,If Pocahontas would have left 2 days early –
145,JOE BIDEN:,"Well, I said –"
146,DONALD TRUMP:,– you would have lost every primary –
147,JOE BIDEN:,All he knows how to do is –
148,DONALD TRUMP:,– on Super Tuesday.
149,JOE BIDEN:,Look.
150,DONALD TRUMP:,You got very lucky.
151,JOE BIDEN:,"Here's the deal.  I got very lucky.  I'm going to get very lucky tonight as well.  And tonight, I'm going to make sure –"
152,DONALD TRUMP:,With what?
153,JOE BIDEN:,Because –
154,DONALD TRUMP:,With what?
155,JOE BIDEN:,Here's the deal.  Here's the deal.  The fact is that everything he's saying so far is simply a lie.  I'm not here to call out his lies.  Everybody knows he's a liar.
156,DONALD TRUMP:,But you agree –
157,JOE BIDEN:,I just want to make sure that –
158,DONALD TRUMP:,"– (inaudible), Joe, you're the liar."
159,JOE BIDEN:,"I, I, I, I want to make sure –"
160,DONALD TRUMP:,"You graduated last in your class, not first in your class."
161,JOE BIDEN:,"Oh, god.  I want to make sure –"
162,CHRIS WALLACE:,"Mr. President, can you let him finish, sir?"
163,JOE BIDEN:,"No, he doesn't know how to do that.  He has –"
164,DONALD TRUMP:,You'd be surprised.
165,JOE BIDEN:,"You know, uh, you, you pick –"
166,DONALD TRUMP:,"You'd be surprised.  Go ahead, Joe."
167,JOE BIDEN:,"– the wrong guy, the wrong night, at the wrong time."
168,DONALD TRUMP:,"Go, go, go on Joe.  No, listen.  You agreed with Bernie Sanders –"
169,JOE BIDEN:,Here's the deal.  The whole idea –
170,DONALD TRUMP:,– and the manifesto –
171,CHRIS WALLACE:,"Let, let, let, let him –"
172,DONALD TRUMP:,– (inaudible).  
173,JOE BIDEN:,"There is no manifesto, number one."
174,CHRIS WALLACE:,"Please let him speak, Mr. President."
175,JOE BIDEN:,Number two –
176,DONALD TRUMP:,He just lost the left.
177,JOE BIDEN:,"Number two, I, I, uh –"
178,DONALD TRUMP:,You just lost the left.  You agreed with Bernie Sanders on a plan –
179,JOE BIDEN:,"How, folks –"
180,DONALD TRUMP:,– that you absolutely agreed to –
181,JOE BIDEN:,"Folks, do you have any idea what this clown's doing?"
182,DONALD TRUMP:,"– and under that plan, you have socialized, they call it Medicare for All."
183,CHRIS WALLACE:,"Mr., Mr. President –"
184,DONALD TRUMP:,Socialized medicine.
185,CHRIS WALLACE:,Mr. President –
186,JOE BIDEN:,"Well, I tell you what.  He is not for any help for people needing healthcare.  Because –"
187,DONALD TRUMP:,Who isn't?  Bernie?
188,JOE BIDEN:,"Because he, in fact, already has cost 10 million people their healthcare that they had from their employers because of his recession, number one."
189,DONALD TRUMP:,"Oh, oh, yeah.  Yeah."
190,JOE BIDEN:,"Number two, there are 20 million people getting healthcare through Obamacare now that he wants to take it away.  He won't ever look you in the eye and say that's what he wants to do, take it away."
191,DONALD TRUMP:,"No, I want to give you better healthcare –"
192,JOE BIDEN:,But –
193,DONALD TRUMP:,– at a much lower price.
194,JOE BIDEN:,"But, and, by the way –"
195,DONALD TRUMP:,Because Obamacare is no good.
196,JOE BIDEN:,"– he doesn't know how, he doesn't know how to do that."
197,DONALD TRUMP:,I've already fixed it.
198,JOE BIDEN:,He has never offered a plan.
199,DONALD TRUMP:,I've already fixed it to an extent.
200,JOE BIDEN:,He has never done a single thing.
201,DONALD TRUMP:,"Obamacare, as you might know, but probably don't, Obamacare is no good, Joe."
202,CHRIS WALLACE:,"Gentlemen, you realize if you're both speaking at the same time –"
203,DONALD TRUMP:,"It's no good, and it's too expensive."
204,CHRIS WALLACE:,"Let, let, let, let the President speak, go ahead, sir."
205,DONALD TRUMP:,"Obamacare is no good.  We made it better.  And I had a choice to make very early on.  We took away the individual mandate.  We guaranteed pre-existing conditions, but took away the individual –  "
206,JOE BIDEN:,Not true.  
207,DONALD TRUMP:,"– the individual mandate.  Listen, this is the way it is.  And that destroyed, that – they shouldn't even call it Obamacare.  Then I had a choice to make, do I let my people run it really well or badly.  If I run it badly, they'll probably blame him, but they'll blame me, but more importantly, I want to help people, okay?  I said, you got to run it so well.  "
208,JOE BIDEN:,That's what he's going for.  
209,DONALD TRUMP:,"And I just had a meeting with them.  They said the problem is, no matter how well you run Obamacare, it's a disaster.  It's too expensive.  "
210,CHRIS WALLACE:,"Okay, I gotcha, I got –  "
211,DONALD TRUMP:,Premiums are too high –  
212,JOE BIDEN:,That's what his –   
213,DONALD TRUMP:,– and it doesn't work.  
214,JOE BIDEN:,That's what his people said.  
215,DONALD TRUMP:,"So, we, we do want to get –  "
216,CHRIS WALLACE:,"I, no, no.  But I, –  "
217,DONALD TRUMP:,– rid of it.  
218,CHRIS WALLACE:,Look –  
219,DONALD TRUMP:,"Chris, we want to get rid of it, –  "
220,CHRIS WALLACE:,– it's an open – I understand –  
221,DONALD TRUMP:,– and get something –  
222,CHRIS WALLACE:,"– that, sir, but I have to –  "
223,DONALD TRUMP:,– that's cheaper and better.  
224,CHRIS WALLACE:,– I have to give you roughly equal time.  
225,DONALD TRUMP:,Okay.  Good.  
226,CHRIS WALLACE:,"Please let the Vice President talk, sir.  "
227,DONALD TRUMP:,Good.  
228,JOE BIDEN:,He has no plan for healthcare.  
229,DONALD TRUMP:,Course we do.  
230,JOE BIDEN:,"He sends, –  "
231,CHRIS WALLACE:,Please.  
232,JOE BIDEN:,"– he sends out wishful thinking.  He has executive orders that have no power.  He hasn't lowered drug costs for anybody.  He's been promising a healthcare plan since he got elected.  He has none, like almost everything else he talks about.  He does not have a plan.  He doesn't have a plan.  And the fact is, this man doesn't know what he's talking about.  He's against –  "
233,CHRIS WALLACE:,"All right, I have one, I have one final question for you, –  "
234,JOE BIDEN:,Sure.  
235,CHRIS WALLACE:,"– uh, Mr. Vice President.  If Senate Republicans – we were talking originally about the Supreme Court here – if Senate Republicans go ahead and confirm Justice Barrett, uh, there has been talk about ending the filibuster or even packing the court, adding to the nine justices there.  You call this a distraction by the President, but, in fact, it wasn't brought up by the President.  It was brought up by some of your Democratic colleagues in – "
236,JOE BIDEN:,"No, I'm saying –  "
237,CHRIS WALLACE:,"– in the Congress.  So my question to you is, you have refused in the past to talk about it, are you willing to tell the American people tonight whether or not you will support either ending the filibuster or packing the court?  "
238,JOE BIDEN:,"Whatever position I take in that, that'll become the issue.  The issue is, the American people should speak.  You should go out and vote.  You're in voting now.  Vote and let your Senators know how strongly you feel.  "
239,DONALD TRUMP:,Are you going to pack the court?  
240,JOE BIDEN:,Let – vote now.  
241,DONALD TRUMP:,Are you going to pack the court?  
242,JOE BIDEN:,"Make sure you, in fact, let people know.  "
243,DONALD TRUMP:,He doesn't want to answer the question.  
244,JOE BIDEN:,"Your Senators.  I'm not going to answer the question, because –  "
245,DONALD TRUMP:,Why wouldn't you answer that question?  
246,JOE BIDEN:,"– because the question is, –  "
247,DONALD TRUMP:,You want to put a lot of new supreme court justices –  
248,JOE BIDEN:,"– the question is, –  "
249,DONALD TRUMP:,– radical left –  
250,JOE BIDEN:,"– the question – will you shut up, man?  "
251,DONALD TRUMP:,"Who is your, listen, who is on your list, Joe?  Who's on your list?"
252,JOE BIDEN:,This is so –  
253,CHRIS WALLACE:,Gentlemen –  
254,JOE BIDEN:,– this is –  
255,CHRIS WALLACE:,– I think we've ended this –  
256,JOE BIDEN:,– this is so unpresidential (inaudible).  
257,DONALD TRUMP:,He's going to pack the court –
258,CHRIS WALLACE:,"– we have ended, no, no.  "
259,DONALD TRUMP:,– and he's not going to give a list.  
260,CHRIS WALLACE:,We have ended this segment.  We're going to move on to the second segment.  
261,JOE BIDEN:,"That was really a productive segment, wasn't it?  Keep yapping, man.  "
262,DONALD TRUMP:,"The people understand, Joe.  "
263,JOE BIDEN:,They sure do.  
264,DONALD TRUMP:,"Forty-seven years, you've done nothing.  They understand."
265,JOE BIDEN:,Oh –  
